{
  "_type": "https://in-toto.io/Statement/v1",
  "subject": [
    {
      "name": "metrics.json",
      "digest": {
        "sha256": "f59381a8d404b585db9857e19a7bd6d3d07f05f3ce14f75e811f23ae54fbcca8"
      }
    },
    {
      "name": "results.ndjson",
      "digest": {
        "sha256": "1b9ac53004a1cbddf3fc64ce15f9ad6721c3d3b44421cbf3850e85a33046c3b2"
      }
    },
    {
      "name": "run.json",
      "digest": {
        "sha256": "0c75e69bb6f21cd85ecaa977bfe6548aac799094f20ba3bcfeea775d91037653"
      }
    },
    {
      "name": "summary.json",
      "digest": {
        "sha256": "97950a5fcbbe5fad1833ca80af0d2caf49c3311e0da9628a941f647ca3156f95"
      }
    }
  ],
  "predicateType": "https://agenteval.dev/aef/1/evidence",
  "predicate": {
    "schemaVersion": "1.0",
    "runId": "R-3",
    "runHash": "8a8af0217f8b45d4fcd658d98d00a2826725d242c240a6385ebb49acc1a1d5d4",
    "producer": {
      "name": "agenteval-cli",
      "version": "1.0.0"
    },
    "subject": {
      "ref": "agent:support/support-triage",
      "version": "git:3f2a1c"
    },
    "deployment": {
      "ref": "deployment:support/support-triage@dev"
    },
    "suite": {
      "ref": "suite:support/triage-scenarios",
      "version": "4",
      "digest": "sha256:4c4c4c4c4c4c4c4c4c4c4c4c4c4c4c4c4c4c4c4c4c4c4c4c4c4c4c4c4c4c4c4c"
    },
    "judges": [
      {
        "model": "gpt-5.1",
        "rubricDigest": "sha256:a9a9a9a9a9a9a9a9a9a9a9a9a9a9a9a9a9a9a9a9a9a9a9a9a9a9a9a9a9a9a9a9"
      }
    ],
    "closedAt": "2026-10-08T12:00:50Z",
    "sealedAt": "2026-10-08T12:00:55Z",
    "sealedBy": "producer"
  }
}
