{
  "_type": "https://in-toto.io/Statement/v1",
  "subject": [
    {
      "name": "blobs/sha256/47/474400071c193b3faf9f2c7f82e28fea484a7b59a07fc0a247282870d6441e99",
      "digest": {
        "sha256": "474400071c193b3faf9f2c7f82e28fea484a7b59a07fc0a247282870d6441e99"
      }
    },
    {
      "name": "evidence.ndjson",
      "digest": {
        "sha256": "0cb5efa41e591fed8fc988a7e2063ba7285b4faebe8ddbac0d7782643ceb8642"
      }
    },
    {
      "name": "gates.ndjson",
      "digest": {
        "sha256": "a7015f35139336ec94132638061773933c7e118c718e81dea171768d1377b26e"
      }
    },
    {
      "name": "metrics.json",
      "digest": {
        "sha256": "81ac87c69d20ca49d69e0a5541b062fe1f8fcc4529117c6d6f29eac1403b3d6c"
      }
    },
    {
      "name": "results.ndjson",
      "digest": {
        "sha256": "af83282333c658548a02227eafa2c463e7ad66a1c94ace48bf3cba0da9694b7e"
      }
    },
    {
      "name": "run.json",
      "digest": {
        "sha256": "69f20a0f63a1ff1fa9521dee737a44ccdba294b7a16a38b1fbe34cac5a1e3890"
      }
    },
    {
      "name": "summary.json",
      "digest": {
        "sha256": "fe9548e607cab4fc632706c94cefc75b67a9efde0c1c0c6bb604206386960a3c"
      }
    },
    {
      "name": "traces.otlp.jsonl",
      "digest": {
        "sha256": "7ed4f10a3ccf2cb1b5f6b44865f2b35896b891c7fd7d05d2ddba7b5ffd417921"
      }
    }
  ],
  "predicateType": "https://agenteval.dev/aef/1/evidence",
  "predicate": {
    "schemaVersion": "1.0",
    "runId": "run-small-1",
    "runHash": "8da9a2ec6cee03034f5b3e3b90cca495268b7dde613a922bf3f0ee29e16f053c",
    "producer": {
      "name": "p",
      "version": "1"
    },
    "subject": {
      "ref": "agent:a/b",
      "version": "v1"
    },
    "deployment": null,
    "suite": null,
    "judges": [],
    "closedAt": "2026-10-01T00:01:00Z",
    "sealedAt": "2026-10-08T09:00:00Z",
    "sealedBy": "producer"
  }
}
