{
  "_type": "https://in-toto.io/Statement/v1",
  "subject": [
    {
      "name": "metrics.json",
      "digest": {
        "sha256": "7be4c9b8d0eeb24dbfe42bf235bf78e7c16f8e634bc029873d7ab272de7b4bd7"
      }
    },
    {
      "name": "results.ndjson",
      "digest": {
        "sha256": "9bdc33cc20100a2854f6e831c7370ef5c78ac8173c4377238b1534c90b4615fb"
      }
    },
    {
      "name": "run.json",
      "digest": {
        "sha256": "7ae062bab1666b1fb51d183a55966039875cdd44595e4568f39a3a65755ba10a"
      }
    },
    {
      "name": "summary.json",
      "digest": {
        "sha256": "3cdc05ca67f8ac24712ee9fc27f2ad37556741d6c4267d10ec988b9718eb7cbb"
      }
    }
  ],
  "predicateType": "https://agenteval.dev/aef/1/evidence",
  "predicate": {
    "schemaVersion": "1.0",
    "runId": "SM",
    "runHash": "0855ba0f9380e8345463b7cfc72a2a8195e39fa3bf9bf451d96a0f27f79075f2",
    "producer": {
      "name": "agenteval-cli",
      "version": "1.0.0"
    },
    "subject": {
      "ref": "agent:shop/assistant",
      "version": "v7"
    },
    "deployment": null,
    "suite": {
      "ref": "suite:shop/memory",
      "version": "3",
      "digest": "sha256:274a646f723ee564ebb96a7bee4170df73b077d42e41ad3fc6a7c825d11dc9b1"
    },
    "judges": [
      {
        "model": "gpt-5.1",
        "rubricDigest": "sha256:72e1d3bc7f71a5266fec19a8953d3b8af83375dd9d4efacb5761968ae4605e35"
      }
    ],
    "closedAt": "2026-10-03T00:00:00Z",
    "sealedAt": "2026-10-07T00:00:00Z",
    "sealedBy": "producer"
  }
}
