{
  "_type": "https://in-toto.io/Statement/v1",
  "subject": [
    {
      "name": "metrics.json",
      "digest": {
        "sha256": "f59381a8d404b585db9857e19a7bd6d3d07f05f3ce14f75e811f23ae54fbcca8"
      }
    },
    {
      "name": "results.ndjson",
      "digest": {
        "sha256": "f647a55ad5f2b8dada18b300a082bf7707aeb282f17ce640d9a1dcc8168b71cb"
      }
    },
    {
      "name": "run.json",
      "digest": {
        "sha256": "5ffacca1d657e4ee35ef2cd6b1866b7bdc6809257475a90a7c85a2ae698683a2"
      }
    },
    {
      "name": "summary.json",
      "digest": {
        "sha256": "5c419eab3b644e909a540ec222c74ce57cf06afa52f2fc278c3667e009025cb7"
      }
    }
  ],
  "predicateType": "https://agenteval.dev/aef/1/evidence",
  "predicate": {
    "schemaVersion": "1.0",
    "runId": "R-1",
    "runHash": "9504d7284a34ab6aba7228486c1679c13cfe60f435f00802bf724b3f5e677c6a",
    "producer": {
      "name": "agenteval-cli",
      "version": "1.0.0"
    },
    "subject": {
      "ref": "agent:support/support-triage",
      "version": "git:3f2a1c"
    },
    "deployment": {
      "ref": "deployment:support/support-triage@dev"
    },
    "suite": {
      "ref": "suite:support/triage-scenarios",
      "version": "4",
      "digest": "sha256:4c4c4c4c4c4c4c4c4c4c4c4c4c4c4c4c4c4c4c4c4c4c4c4c4c4c4c4c4c4c4c4c"
    },
    "judges": [
      {
        "model": "gpt-5.1",
        "rubricDigest": "sha256:a9a9a9a9a9a9a9a9a9a9a9a9a9a9a9a9a9a9a9a9a9a9a9a9a9a9a9a9a9a9a9a9"
      }
    ],
    "closedAt": "2026-10-08T12:00:50Z",
    "sealedAt": "2026-10-08T12:00:55Z",
    "sealedBy": "producer"
  }
}
