{
  "_type": "https://in-toto.io/Statement/v1",
  "subject": [
    {
      "name": "metrics.json",
      "digest": {
        "sha256": "81ac87c69d20ca49d69e0a5541b062fe1f8fcc4529117c6d6f29eac1403b3d6c"
      }
    },
    {
      "name": "results.ndjson",
      "digest": {
        "sha256": "de215e89de9418d6751d7c63bb2893c5f191c2916a8487bff91d8882f336c959"
      }
    },
    {
      "name": "run.json",
      "digest": {
        "sha256": "c458dc99c39d36db3a9a191feea37712560a49e035ee7d6d2dd707679a829785"
      }
    },
    {
      "name": "summary.json",
      "digest": {
        "sha256": "e48336852fa5deacd8e49f1d625fddc5a75610423a5b38f134069de5683dce07"
      }
    }
  ],
  "predicateType": "https://agenteval.dev/aef/1/evidence",
  "predicate": {
    "schemaVersion": "1.0",
    "runId": "G-replayed",
    "runHash": "a992db425cc27bea1f31d693e23f4aaa44ca8d036a6a83ee35c258811ba05d91",
    "producer": {
      "name": "agenteval-cli",
      "version": "1.0.0"
    },
    "subject": {
      "ref": "agent:shop/assistant",
      "version": "v7"
    },
    "deployment": null,
    "suite": {
      "ref": "suite:shop/memory",
      "version": "3",
      "digest": "sha256:274a646f723ee564ebb96a7bee4170df73b077d42e41ad3fc6a7c825d11dc9b1"
    },
    "judges": [
      {
        "model": "gpt-5.1",
        "rubricDigest": "sha256:72e1d3bc7f71a5266fec19a8953d3b8af83375dd9d4efacb5761968ae4605e35"
      }
    ],
    "closedAt": "2026-10-05T00:00:00Z",
    "sealedAt": "2026-10-07T00:00:00Z",
    "sealedBy": "producer"
  }
}
