{
  "_type": "https://in-toto.io/Statement/v1",
  "subject": [
    {
      "name": "blobs/sha256/63/635221c9c64f48e2843e4186b0a1b66f07a1492c14dcb866bb83dba6a5e5fef5",
      "digest": {
        "sha256": "635221c9c64f48e2843e4186b0a1b66f07a1492c14dcb866bb83dba6a5e5fef5"
      }
    },
    {
      "name": "evidence.ndjson",
      "digest": {
        "sha256": "f76af41ebe790477719e419c60ab430ef5cc98263b8fd8dd5bb52988a03108b1"
      }
    },
    {
      "name": "gates.ndjson",
      "digest": {
        "sha256": "6db8527cfa0e3d60c242253e40f123eb56b4105f2b14a622af21370fd10b9c63"
      }
    },
    {
      "name": "metrics.json",
      "digest": {
        "sha256": "cd5980b59a1023260f2c7fa19d0a8075802dbb17e83485a547dc3b977649ef87"
      }
    },
    {
      "name": "results.ndjson",
      "digest": {
        "sha256": "6a9d514c30f559995841b72656866a5ea969d2378e7cdce50e23353a87c9e84b"
      }
    },
    {
      "name": "run.json",
      "digest": {
        "sha256": "6833f5f2e31f266973749d72f60cf9656d8689145780a14670e35c07795c1f5c"
      }
    },
    {
      "name": "summary.json",
      "digest": {
        "sha256": "268eda205f131668d931d8804c9530cb7c99b2857d95e1ce1bc24fc3d6314679"
      }
    },
    {
      "name": "traces.otlp.jsonl",
      "digest": {
        "sha256": "3c29fa780cb029dd541c36edb35614f49df76f459a1f7c3e3702960892398787"
      }
    }
  ],
  "predicateType": "https://agenteval.dev/aef/1/evidence",
  "predicate": {
    "schemaVersion": "1.0",
    "runId": "01928f3e-7c1a-7b2e-9a51-3f2c0d4e8a10",
    "runHash": "7a42eaef3b1aa6eccfdbdbd14095533ed237f09ab28d81dd30bb53a7a829b8b2",
    "producer": {
      "name": "agenteval-cli",
      "version": "1.0.0"
    },
    "subject": {
      "ref": "agent:support/support-triage",
      "version": "git:3f2a1c"
    },
    "deployment": {
      "ref": "deployment:support/support-triage@dev"
    },
    "suite": {
      "ref": "suite:support/triage-scenarios",
      "version": "4",
      "digest": "sha256:f1b4f6f2c254e91b0c23b6c40c1554dd8a7b04715858206d4537698e34caaedd"
    },
    "judges": [
      {
        "model": "gpt-5.1",
        "rubricDigest": "sha256:29fd018a9848938bc2b0e33fffa32bde2827e81388d0e03195919be5835c3605"
      }
    ],
    "closedAt": "2026-10-02T14:06:23.004Z",
    "sealedAt": "2026-10-02T14:06:24Z",
    "sealedBy": "producer"
  }
}
